{
  "$schema": "https://json-schema.org/draft/2020-12/schema",
  "$id": "https://aquascape.dev/schemas/aqua-document-v3.json",
  "title": "AquaDocument",
  "description": "Aquascape layout document, schema version 3. All linear units are millimetres. v2 adds optional Layer.zone (foreground/midground/background); v3 adds optional Tank.waterLevelMm (water-surface height above the interior floor, integer mm; absent = default fill derived at render time; the [1, height] upper bound is advisory — cross-field comparison is not expressible here). Prior-version docs migrate forward without transformation.",
  "type": "object",
  "required": ["format", "schemaVersion", "meta", "tank", "substrate", "layers"],
  "additionalProperties": false,
  "properties": {
    "format": { "const": "aquascape" },
    "schemaVersion": { "type": "integer", "minimum": 1 },
    "meta": { "$ref": "#/$defs/DocumentMeta" },
    "tank": { "$ref": "#/$defs/Tank" },
    "substrate": { "$ref": "#/$defs/Substrate" },
    "layers": { "type": "array", "items": { "$ref": "#/$defs/Layer" } },
    "livestock": { "type": "array", "items": { "$ref": "#/$defs/LivestockEntry" } },
    "equipment": { "type": "array", "items": { "$ref": "#/$defs/EquipmentEntry" } },
    "renderHistory": { "type": "array", "items": { "$ref": "#/$defs/RenderRecord" } },
    "extensions": { "type": "object" }
  },
  "$defs": {
    "Vec3": {
      "type": "object",
      "required": ["x", "y", "z"],
      "additionalProperties": false,
      "properties": {
        "x": { "type": "number" },
        "y": { "type": "number" },
        "z": { "type": "number" }
      }
    },
    "Vec2": {
      "type": "object",
      "required": ["x", "y"],
      "additionalProperties": false,
      "properties": {
        "x": { "type": "number" },
        "y": { "type": "number" }
      }
    },
    "HexColor": { "type": "string", "pattern": "^#([0-9a-fA-F]{6}|[0-9a-fA-F]{8})$" },
    "Uuid": { "type": "string", "format": "uuid" },
    "Transform": {
      "type": "object",
      "required": ["position", "rotation", "scale", "flipX", "flipY"],
      "additionalProperties": false,
      "properties": {
        "position": { "$ref": "#/$defs/Vec3" },
        "rotation": {
          "type": "object",
          "required": ["x", "y", "z"],
          "additionalProperties": false,
          "properties": {
            "x": { "type": "number" },
            "y": { "type": "number" },
            "z": { "type": "number" }
          }
        },
        "scale": {
          "type": "object",
          "required": ["x", "y", "z"],
          "additionalProperties": false,
          "properties": {
            "x": { "type": "number", "exclusiveMinimum": 0 },
            "y": { "type": "number", "exclusiveMinimum": 0 },
            "z": { "type": "number", "exclusiveMinimum": 0 }
          }
        },
        "flipX": { "type": "boolean" },
        "flipY": { "type": "boolean" }
      }
    },
    "CatalogRef": {
      "type": "object",
      "required": ["catalog", "id", "version"],
      "additionalProperties": false,
      "properties": {
        "catalog": { "type": "string", "minLength": 1 },
        "id": { "type": "string", "minLength": 1 },
        "version": { "type": "integer", "minimum": 1 }
      }
    },
    "AssetRef": {
      "type": "object",
      "required": ["id", "uri", "mimeType"],
      "additionalProperties": false,
      "properties": {
        "id": { "$ref": "#/$defs/Uuid" },
        "uri": { "type": "string", "minLength": 1 },
        "mimeType": { "type": "string" },
        "width": { "type": "integer", "minimum": 0 },
        "height": { "type": "integer", "minimum": 0 },
        "hash": { "type": "string" }
      }
    },
    "DocumentMeta": {
      "type": "object",
      "required": ["id", "title", "createdAt", "updatedAt", "appVersion", "seed"],
      "additionalProperties": false,
      "properties": {
        "id": { "$ref": "#/$defs/Uuid" },
        "title": { "type": "string" },
        "description": { "type": "string" },
        "author": { "type": "string" },
        "createdAt": { "type": "string", "format": "date-time" },
        "updatedAt": { "type": "string", "format": "date-time" },
        "appVersion": { "type": "string" },
        "isTemplate": { "type": "boolean" },
        "tags": { "type": "array", "items": { "type": "string" } },
        "remixOf": {
          "type": "object",
          "required": ["documentId"],
          "additionalProperties": false,
          "properties": {
            "documentId": { "$ref": "#/$defs/Uuid" },
            "author": { "type": "string" },
            "source": { "type": "string" }
          }
        },
        "seed": { "type": "number" }
      }
    },
    "Tank": {
      "type": "object",
      "required": ["width", "height", "depth", "style"],
      "additionalProperties": false,
      "properties": {
        "width": { "type": "number", "exclusiveMinimum": 0 },
        "height": { "type": "number", "exclusiveMinimum": 0 },
        "depth": { "type": "number", "exclusiveMinimum": 0 },
        "glassThickness": { "type": "number", "minimum": 0 },
        "waterLevelMm": { "type": "integer", "minimum": 1 },
        "presetRef": { "$ref": "#/$defs/CatalogRef" },
        "style": { "$ref": "#/$defs/TankStyle" }
      }
    },
    "TankStyle": {
      "type": "object",
      "required": ["frame", "background"],
      "additionalProperties": false,
      "properties": {
        "frame": { "enum": ["rimless", "framed", "braced"] },
        "frameColor": { "$ref": "#/$defs/HexColor" },
        "waterTint": { "$ref": "#/$defs/HexColor" },
        "background": {
          "oneOf": [
            {
              "type": "object",
              "required": ["kind", "color"],
              "additionalProperties": false,
              "properties": {
                "kind": { "const": "color" },
                "color": { "$ref": "#/$defs/HexColor" }
              }
            },
            {
              "type": "object",
              "required": ["kind", "asset"],
              "additionalProperties": false,
              "properties": {
                "kind": { "const": "image" },
                "asset": { "$ref": "#/$defs/AssetRef" }
              }
            },
            {
              "type": "object",
              "required": ["kind", "angle", "stops"],
              "additionalProperties": false,
              "properties": {
                "kind": { "const": "gradient" },
                "angle": { "type": "number" },
                "stops": {
                  "type": "array",
                  "minItems": 2,
                  "items": {
                    "type": "object",
                    "required": ["at", "color"],
                    "additionalProperties": false,
                    "properties": {
                      "at": { "type": "number", "minimum": 0, "maximum": 1 },
                      "color": { "$ref": "#/$defs/HexColor" }
                    }
                  }
                }
              }
            },
            {
              "type": "object",
              "required": ["kind"],
              "additionalProperties": false,
              "properties": { "kind": { "const": "none" } }
            }
          ]
        }
      }
    },
    "Substrate": {
      "type": "object",
      "required": ["regions"],
      "additionalProperties": false,
      "properties": {
        "regions": { "type": "array", "items": { "$ref": "#/$defs/SubstrateRegion" } }
      }
    },
    "SubstrateRegion": {
      "type": "object",
      "required": ["id", "material", "fromX", "toX", "profile"],
      "additionalProperties": false,
      "properties": {
        "id": { "$ref": "#/$defs/Uuid" },
        "material": { "$ref": "#/$defs/CatalogRef" },
        "fromX": { "type": "number", "minimum": 0, "maximum": 1 },
        "toX": { "type": "number", "minimum": 0, "maximum": 1 },
        "blend": { "type": "number", "minimum": 0 },
        "profile": {
          "type": "array",
          "minItems": 2,
          "items": {
            "type": "object",
            "required": ["x", "y"],
            "additionalProperties": false,
            "properties": {
              "x": { "type": "number", "minimum": 0, "maximum": 1 },
              "y": { "type": "number", "minimum": 0 }
            }
          }
        }
      }
    },
    "Layer": {
      "type": "object",
      "required": ["id", "name", "opacity", "visible", "locked", "objects"],
      "additionalProperties": false,
      "properties": {
        "id": { "$ref": "#/$defs/Uuid" },
        "name": { "type": "string" },
        "opacity": { "type": "number", "minimum": 0, "maximum": 1 },
        "visible": { "type": "boolean" },
        "locked": { "type": "boolean" },
        "objects": { "type": "array", "items": { "$ref": "#/$defs/SceneObject" } },
        "zone": { "enum": ["foreground", "midground", "background"] }
      }
    },
    "SceneObject": {
      "oneOf": [
        { "$ref": "#/$defs/HardscapeObject" },
        { "$ref": "#/$defs/PlantObject" },
        { "$ref": "#/$defs/DecorObject" }
      ]
    },
    "HardscapeObject": {
      "type": "object",
      "required": ["kind", "id", "transform", "ref"],
      "additionalProperties": false,
      "properties": {
        "kind": { "const": "hardscape" },
        "id": { "$ref": "#/$defs/Uuid" },
        "transform": { "$ref": "#/$defs/Transform" },
        "groupId": { "$ref": "#/$defs/Uuid" },
        "note": { "type": "string" },
        "ref": { "$ref": "#/$defs/CatalogRef" },
        "category": { "enum": ["rock", "wood", "other"] }
      }
    },
    "PlantObject": {
      "type": "object",
      "required": ["kind", "id", "transform", "ref", "growth"],
      "additionalProperties": false,
      "properties": {
        "kind": { "const": "plant" },
        "id": { "$ref": "#/$defs/Uuid" },
        "transform": { "$ref": "#/$defs/Transform" },
        "groupId": { "$ref": "#/$defs/Uuid" },
        "note": { "type": "string" },
        "ref": { "$ref": "#/$defs/CatalogRef" },
        "zone": { "enum": ["foreground", "midground", "background"] },
        "growth": {
          "type": "object",
          "required": ["ageWeeks", "vigor"],
          "additionalProperties": false,
          "properties": {
            "ageWeeks": { "type": "number", "minimum": 0 },
            "vigor": { "type": "number", "exclusiveMinimum": 0 }
          }
        },
        "scatter": {
          "type": "object",
          "required": ["polygon", "density"],
          "additionalProperties": false,
          "properties": {
            "polygon": { "type": "array", "minItems": 3, "items": { "$ref": "#/$defs/Vec2" } },
            "density": { "type": "number", "exclusiveMinimum": 0 },
            "seed": { "type": "number" }
          }
        }
      }
    },
    "DecorObject": {
      "type": "object",
      "required": ["kind", "id", "transform", "ref"],
      "additionalProperties": false,
      "properties": {
        "kind": { "const": "decor" },
        "id": { "$ref": "#/$defs/Uuid" },
        "transform": { "$ref": "#/$defs/Transform" },
        "groupId": { "$ref": "#/$defs/Uuid" },
        "note": { "type": "string" },
        "ref": { "$ref": "#/$defs/CatalogRef" },
        "excludeFromScapeExport": { "type": "boolean" }
      }
    },
    "LivestockEntry": {
      "type": "object",
      "required": ["id", "ref", "quantity"],
      "additionalProperties": false,
      "properties": {
        "id": { "$ref": "#/$defs/Uuid" },
        "ref": { "$ref": "#/$defs/CatalogRef" },
        "quantity": { "type": "integer", "minimum": 1 },
        "decorObjectId": { "$ref": "#/$defs/Uuid" }
      }
    },
    "EquipmentEntry": {
      "type": "object",
      "required": ["id", "ref"],
      "additionalProperties": false,
      "properties": {
        "id": { "$ref": "#/$defs/Uuid" },
        "ref": { "$ref": "#/$defs/CatalogRef" },
        "settings": { "type": "object" },
        "note": { "type": "string" }
      }
    },
    "RenderRecord": {
      "type": "object",
      "required": ["id", "createdAt", "provider", "request", "resultAsset"],
      "additionalProperties": false,
      "properties": {
        "id": { "$ref": "#/$defs/Uuid" },
        "createdAt": { "type": "string", "format": "date-time" },
        "provider": {
          "type": "object",
          "required": ["kind", "name"],
          "additionalProperties": false,
          "properties": {
            "kind": { "enum": ["local", "hosted"] },
            "name": { "type": "string" }
          }
        },
        "request": {
          "type": "object",
          "required": ["prompt"],
          "additionalProperties": false,
          "properties": {
            "prompt": { "type": "string" },
            "seed": { "type": "number" },
            "sourceRenderAssetId": { "$ref": "#/$defs/Uuid" },
            "params": { "type": "object" }
          }
        },
        "resultAsset": { "$ref": "#/$defs/AssetRef" }
      }
    }
  }
}
